USE tpch1;
drop table if exists t4126_1;
drop table if exists t4126_2;
create table t4126_1 (idx int, col varchar(20)) engine=columnstore;
create table t4126_2 (idx int, col varchar(20), col2 varchar(20)) engine=columnstore;
insert into t4126_1 values (3, 'a');
select * from t4126_1;
idx	col
3	a
insert into t4126_2 values (1, 'lamp', 'table lamp');
select * from t4126_2;
idx	col	col2
1	lamp	table lamp
update t4126_2 set col = "floor lamp" where col = 'lamp';
drop table if exists t4126_1;
drop table if exists t4126_2;
create table t4126_1 (idx1 int, col1 varchar(20)) engine=columnstore;
insert into t4126_1 values (3, 'a');
select * from t4126_1;
idx1	col1
3	a
drop table if exists t4126_1;
