DROP DATABASE IF EXISTS mcol_4628;
CREATE DATABASE mcol_4628;
USE mcol_4628;
DROP TABLE IF EXISTS t1;
CREATE TABLE t1 (i INT, d DOUBLE) ENGINE=ColumnStore;
INSERT INTO t1 VALUES (0, 1.5);
UPDATE t1 SET i=d;
SELECT * FROM t1;
i	d
2	1.5
DROP TABLE IF EXISTS t1;
CREATE TABLE t1 (i INT, d DOUBLE) ENGINE=ColumnStore;
INSERT INTO t1 VALUES (0, 1.7);
UPDATE t1 SET i=d;
SELECT * FROM t1;
i	d
2	1.7
DROP TABLE IF EXISTS t1;
CREATE TABLE t1 (i INT, d DOUBLE) ENGINE=ColumnStore;
INSERT INTO t1 VALUES (0, 1.4);
UPDATE t1 SET i=d;
SELECT * FROM t1;
i	d
1	1.4
DROP TABLE IF EXISTS t1;
CREATE TABLE t1 (i INT, d DOUBLE) ENGINE=ColumnStore;
INSERT INTO t1 VALUES (0, -0.5);
UPDATE t1 SET i=d;
SELECT * FROM t1;
i	d
0	-0.5
DROP TABLE IF EXISTS t1;
CREATE TABLE t1 (i INT UNSIGNED, d DOUBLE) ENGINE=ColumnStore;
INSERT INTO t1 VALUES (0, 0.5);
UPDATE t1 SET i=d;
SELECT * FROM t1;
i	d
1	0.5
DROP TABLE IF EXISTS t1;
CREATE TABLE t1 (i INT UNSIGNED, d DOUBLE) ENGINE=ColumnStore;
INSERT INTO t1 VALUES (0, 1.5);
UPDATE t1 SET i=d;
SELECT * FROM t1;
i	d
2	1.5
DROP TABLE IF EXISTS t1;
CREATE TABLE t1 (i INT UNSIGNED, d DOUBLE) ENGINE=ColumnStore;
INSERT INTO t1 VALUES (0, 1.4);
UPDATE t1 SET i=d;
SELECT * FROM t1;
i	d
1	1.4
DROP TABLE IF EXISTS t1;
CREATE TABLE t1 (i SMALLINT) ENGINE=ColumnStore;
INSERT INTO t1 VALUES (-762);
INSERT INTO t1 VALUES  (-761);
INSERT INTO t1 VALUES (761);
INSERT INTO t1 VALUES (762);
SELECT * FROM t1 WHERE i > -762.5;
i
-762
-761
761
762
DROP TABLE IF EXISTS t1;
CREATE TABLE t1 (i SMALLINT) ENGINE=ColumnStore;
INSERT INTO t1 VALUES (-762);
INSERT INTO t1 VALUES  (-761);
INSERT INTO t1 VALUES (761);
INSERT INTO t1 VALUES (762);
SELECT * FROM t1 WHERE i > -762.2;
i
-762
-761
761
762
DROP DATABASE mcol_4628;
