DROP DATABASE IF EXISTS mcol_4627;
CREATE DATABASE mcol_4627;
USE mcol_4627;
DROP TABLE IF EXISTS t1;
CREATE TABLE t1 (i INT, d DECIMAL(10,1)) ENGINE=ColumnStore;
INSERT INTO t1 VALUES (0, 1.5);
UPDATE t1 SET i=d;
SELECT * FROM t1;
i	d
2	1.5
DROP TABLE IF EXISTS t1;
CREATE TABLE t1 (i INT, d DECIMAL(10,1)) ENGINE=ColumnStore;
INSERT INTO t1 VALUES (0, 1.4);
UPDATE t1 SET i=d;
SELECT * FROM t1;
i	d
1	1.4
DROP TABLE IF EXISTS t1;
CREATE TABLE t1 (i INT, d DECIMAL(10,1)) ENGINE=ColumnStore;
INSERT INTO t1 VALUES (0, -0.5);
UPDATE t1 SET i=d;
SELECT * FROM t1;
i	d
0	-0.5
DROP TABLE IF EXISTS t1;
CREATE TABLE t1 (i INT UNSIGNED, d DECIMAL(10,1)) ENGINE=ColumnStore;
INSERT INTO t1 VALUES (0, 0.5);
UPDATE t1 SET i=d;
SELECT * FROM t1;
i	d
1	0.5
DROP DATABASE mcol_4627;
