create database if not exists test_ranges;
use test_ranges;
drop table if exists t;
create table t(x integer) engine=columnstore;
insert into t(x) values (44),(55),(66);
select max_value, min_value from information_schema.columnstore_extents;
max_value	min_value
66	44
delete from t where x=44;
select max_value, min_value from information_schema.columnstore_extents;
max_value	min_value
NULL	NULL
drop database test_ranges;
